{
  "invocationId": "fluidvirt-invocation-cpu-001",
  "applyRequestId": "apply-request-cpu-001",
  "actuator": "FluidVirt",
  "actuatorRole": "guarded_runtime_actuator_invocation_provider",
  "actuatorEndpointClass": "guarded_invocation_record",
  "invocationMode": "operator_approved_apply",
  "mutationFamily": "cpu_entitlement",
  "targetDonor": "shell-container-donor-a",
  "targetReceiver": "shell-container-replica-b",
  "resource": "cpu",
  "amount": "500m",
  "invokedAt": "2026-05-14T15:06:30Z",
  "invokedBy": "FluidVirt/hyperdensity-guarded-apply",
  "requestAccepted": true,
  "mutationExecuted": true,
  "mutationResultRef": "mutation-observation-cpu-001",
  "rollbackPlanRef": "rollback-plan-cpu-001",
  "rawRuntimeControlsExposed": false,
  "productionScope": false,
  "autoApplyAllowed": false,
  "productionAutonomousApplyAllowed": false,
  "evidenceRefs": ["hyperdensity_guarded_apply_invocation_surface_v1"],
  "claimBoundary": ["mutation executed only with operator approval and productionScope=false"]
}
